Company Name,Website,Phone,Industry,Company Size,Headquarters,Type,Founded,Location,Specialties
CanaanSystems,https://www.canaansystems.pro,,Information Technology & Services,2-10 employees,"Conakry, R√©publique de Guin√©e",Sole Proprietorship,2017,"Conakry, Conakry, R√©publique de Guin√©e 224, GN","Syst√®me Cloud, Linux/Unix, Cisco Networking, Base de donn√©es, Web, Maintenance, and Android/IOS"
Delta Express SARL,http://www.deltagn.com,,Package/Freight Delivery,2-10 employees,,Privately Held,2013,"Dixinn, angle Dixinn bora et route de Bellevue, face rest. Echangeur, Conakry, BP : 1999, GN",
ECONOMA,http://www.economa.fr,,Consumer Goods,2-10 employees,"Conakry, Guinea",Privately Held,2018,"Kaporo, Conakry, Guinea 3141, GN",
BEVALDIA,https://bevaldia.com/,+30 2109582176,Shipbuilding,51-200 employees,"Maroussi, Athens",Partnership,,,
Groupe Action Op√©ration Solutions,http://www.actopsolutions.com,2.25E+11,Security & Investigations,"501-1,000 employees","Conakry, Commune de Dixinn",Partnership,2017,"3179P Conakry, Pr√®s de la jet√©e, Conakry, Commune de Dixinn 3179P, GN",
INFLUENCE Corporate,http://influencecorporate.com,,Public Relations & Communications,2-10 employees,"Paris, (France)",Sole Proprietorship,2015,,"Communication institutionnelle, Partenariat Public-Priv√©, Campagnes √©lectorales, Ev√©nements d'influence, Relations publiques, E-Reputation, Politiques publiques, and Fundraising"
Eight Technology,http://www.eightechnology.com,623419147,Computer Hardware,2-10 employees,"Conakry, B G",Privately Held,2017,"Conakry, Koloma March√©, Conakry, B G 00000, GN",
Douno Technology,http://dounotech.com,,Information Technology & Services,2-10 employees,,Privately Held,2012,"Lambangni (en face ISSEG), Conakry, GN","Web Design, Web Development, Software Development, Mobile Application Development, IT Security, IT Maintenance, Graphic Design, Telecommunication, Computer Networking, and IT Training"
Chiguipharm SARL,https://chiguipharm.com/,+224 622 966 750,Pharmaceuticals,11-50 employees,"Conakry, Guin√©e",Privately Held,1999,"5068 Dixin ,Conakry , Guin√©e, Batiment, Conakry, Guin√©e 5068, GN",
AFRICAN EXPERTISE COMMUNICATION,http://africanec.com/,,Public Relations & Communications,2-10 employees,"CONAKRY, GUINEE",Privately Held,2016,"Kip√© centre √©metteur, BP 101 Commune de Ratoma, CONAKRY, GUINEE BP 101, GN","communication, m√©dias, web marketing, presse, gestion de projet, strat√©gie, SEO/SEA, SITE INTERNET, and PLAN DE COMMUNICATION"
Fily Consultance Immobiliere,https://filyimmobiliere.business.site/,2.22E+11,Real Estate,0-1 employees,"Dakar, Dakar",Sole Proprietorship,2018,,"consultant immobilier and achat appartements, maison, immeuble de prestige"
ECDG GUINEE,http://www.ecdgguinee.com,,Construction,201-500 employees,"CONAKRY, KALOUM",Privately Held,1990,"KALOUM, 1ER ETAGE, CONAKRY, KALOUM 1973, GN",
Gamma Concept SA,http://www.gammaconcept.com,622350375,Information Technology & Services,2-10 employees,"Conakry, Ratoma",Partnership,2004,"Ratoma BP : 200 , Corniche Taouyah - Taouyah, Conakry, Ratoma 200, GN",Int√©grateur de Syst√®me Informatique et T√©l√©communication
Club Questions Pour Un Champion de Ratoma (Guin√©e),http://www.clubqpucratoma.wordpress.com,+224 622 557 721,Events Services,2-10 employees,"Conakry, Ratoma",Educational Institution,2019,"Conakry, Ratoma 3212, GN","Culture G√©n√©rale, Animation Jeu, and Connaissances G√©n√©rales"
Guinee Digitale,https://forms.gle/k2mprFhNtXnaCQX37,2.25E+11,Information Technology & Services,2-10 employees,"Conakry, Kaloum",Sole Proprietorship,2019,"Conakry, Kaloum 00224, GN",
African Initiative for Micro-Industries,,,Business Supplies & Equipment,2-10 employees,,Partnership,,"Conakry, GN",
Cabinet-ceforma,http://Cabinet-ceforma.com,,Professional Training & Coaching,2-10 employees,"Conakry, Matoto",Partnership,,"Matoto Kondebougni en face de la mosqu√©e Fofana derri√®re la Radio Espace FM Si√®ge du cabinet 1er √©tage immeuble cheick Fanta Mady Camara Kondebounyi en face de la mosqu√©e Fofana, Conakry, Matoto 6760 , GN",
Frotcom Guinee,http://www.frotcom.com,,Information Technology & Services,2-10 employees,"Corniche Sud, Conakry",Privately Held,,"corniche Madina, Corniche Sud, Conakry 001, GN","Vehicle tracking system, Fleet management, Fuel management, Fleet intelligence, Workforce management, Cost management, Remote tachograph download, Route planning and monitoring, Driver behaviour analysis, CANBus data reading, Integrated navigation, GPS tracking"
FAAR,,,Marketing & Advertising,2-10 employees,,Sole Proprietorship,,"Lambanyi, Conakry, GN",
GWS,http://www.goldwater.se,,Mining & Metals,51-200 employees,"Conakry, Conakry",Privately Held,,,gold mining
ISORIS Consulting Group,http://www.isoris-gn.com/index.php,,Management Consulting,11-50 employees,,Partnership,,"isorisca@gmail.com, infos@isoris-gn.com, Conakry, 669, GN","ISORIS Taxe and legal, ISORIS Consulting, ISORIS Jobservices, ISORIS Training, and ISORIS Finance"
SiverNet,http://www.sivernet.com,,Information Technology & Services,11-50 employees,"Conakry, NA",Privately Held,2004,"Kaporo Rail, Commune de Ratoma, Conakry, NA 00000, GN",
LOGIC HEALTH CONSULTING (LHC),http://www.logichealthconsulting.org,,"Health, Wellness & Fitness",2-10 employees,"Conakry, R√©gion de Conakry",Partnership,2020,"Conakry, R√©gion de Conakry GN","Etudes en Sant√© Publique, Formations Certifiantes, Management Structures Sanitaires, Promotion de la Sant√©, Partenariat Public Priv√©e, and HSSE"
Auger Drilling Services (ADS),https://augerdrillingservices.com/,2.33E+11,Mining & Metals,51-200 employees,,Partnership,2019,,"Mineral Exploration Services, Auger Drilling, Project Management, and Geological Services"
ConakryPUB,http://www.conakrypub.com,2.25E+11,Online Media,201-500 employees,"conakry, Guin√©e",Sole Proprietorship,2020,"conakry, Guin√©e GN",
Westaf Group,http://westafgroup.com/,,Logistics & Supply Chain,11-50 employees,"Conakry, Basse Guin√©e",Privately Held,,"Kip√© Commune de Ratoma, Conakry, Basse Guin√©e 00224, GN",
ASSOCIATION DE JEUNES POUR LA PROMOTION HUMAINE,,2.25E+11,Philanthropy,51-200 employees,,Nonprofit,2018,"CONAKRY , GN",
Nimbagold sarl,http://nimbagold.info/,+224 622321586,Mining & Metals,11-50 employees,"Conakry, commune matoto",Sole Proprietorship,2014,"Gbessia, Conakry, commune matoto 001, GN",
EM Business,,,Mining & Metals,2-10 employees,"Conakry, Conakry",Sole Proprietorship,2017,"Ratoma, Conakry, Conakry 00224, GN","Mining, Logistics, Environment, Cartography, and Trading"
R√©seaux,https://www.guinea-energy.com/reseau,00224 628 21 39 37,Oil & Energy,2-10 employees,"conakry, Conakry",Privately Held,2019,"Kipe T2/conakry, 3eme √©tage, conakry, Conakry 136824, GN","LIGNES ELECTRIQUES (HT,MT,BT), POSE DES TRANSFORMATEURS, MONTAGE DES PYLONES, POSTE ET SOUS-STATIONS, and INSPECTION DES INSTALLATIONS ELECTRIQUES"
World Connection/ Woco-Solar,http://www.wocosolar.com,,Renewables & Environment,51-200 employees,,Sole Proprietorship,2001,"Rue De La Gare B.P 1185, Conakry, GN","Installation of street lights, Consulting, Home installation, and Satisfactory customer service"
Sestek Insaat,http://www.sestekinsaat.com,,Construction,201-500 employees,,Partnership,2020,,
SOS Littoral Guin√©e,,,,,"Conakry, Afrique Occidentale",,,"Taouyah, Conakry, Afrique Occidentale 1254, GN",
CACIA GROUPE,http://www.cacia-groupe.com,,Food Production,51-200 employees,"CONAKRY, RATOMA",Privately Held,,"CONAKRY, RATOMA 00224, GN",
BSB VOYAGES GUINEE,http://www.sennadeinvestmentgroup.com,623462739,"Leisure, Travel & Tourism",2-10 employees,"CONAKRY, MATAM/AUTOROUTE",Sole Proprietorship,2017,"MATAM, BUREAU A108 BLOC A, CONAKRY, MATAM/AUTOROUTE 2704, GN",
SOLIDIAGUI,https://solidiagui.com/,+224 621 24 24 55,Wholesale,11-50 employees,"conakry, Guinee",Sole Proprietorship,,"conakry, Guinee 224, GN",
TMD Company Excellence - Client,,00224 621 66 13 45,Professional Training & Coaching,2-10 employees,"Conakry, Conakry",Sole Proprietorship,2018,"Rue1, Lambanyi carrefour, Conakry, Conakry 4561, GN","Offre de visibilit√©, Marketing Digital, Outils digitaux de pointe, and Incubation, Formation et employabilit√© de la jeunesse dans les nouveaux m√©tiers du num√©rique"
ALF Logistiques,,626767972,Logistics & Supply Chain,2-10 employees,"Conakry, Guin√©e",Partnership,2018,,
AFRIK CASH,https://www.afrikcash.com,,Financial Services,2-10 employees,,Partnership,2017,"Carrefour Conteya, Nongo , Conakry, GN",transfert d'argent
EBooster,http://www.eboosterae.com,,Professional Training & Coaching,2-10 employees,"Conakry, Conakry",Sole Proprietorship,2018,"Dixinn Centre I, Conakry, Conakry 00224, GN","Coaching, Formation, Forum, Panel, and Business Plan"
Ethical Stones,http://www.ethical-stones.org,+41 22 547 7070,Non-profit Organization Management,11-50 employees,"Geneva, GE",Nonprofit,2015,,
HORIZON - Entrepreneurs,,2.25E+11,Public Relations & Communications,11-50 employees,,Partnership,2019,"Conakry, GN","Investissement particulier, Management de projet, Entrepreneuriat, Relation Ship , Relation internationale, D√©veloppement personnel, Conseil entrepreneur-investisseur, Communication, Publicit√© , and Design"
Guin√©e Opinions Positives et Pan-Africainistes,,,Public Policy,,,,,"Conakry, Lambanyi, Ratoma 838, GN",
Guin√©e innovations,http://www.guineeinnovations.com,,Online Media,2-10 employees,"Conakry, Guin√©e",,2018,"Bonfi route niger, Conakry, Guin√©e 224, GN",
Cultivez votre jardin,,,"Health, Wellness & Fitness",2-10 employees,,Nonprofit,2020,,
Krezus Mining Guinee SA,http://krezus.com,,,,,,,,
WARCIP-GUINEE,,,,,,,,,
Friguia SA,,,,2-10 employees,"Fria, Kindia",,,,
GECOST,http://www.gecost-service.com,,Architecture & Planning,2-10 employees,,Partnership,,"NONGO, GN",
Soudou immo.com,https://www.soudouimmo.com,2.25E+11,Real Estate,2-10 employees,"Conakry, Ratoma",Partnership,2018,"Conakry, Ratoma 00224, GN",
Guinea consulting,http://www.guineaconsulting.com,624634010,Management Consulting,2-10 employees,"CONAKRY, Aucun",Sole Proprietorship,2014,"CONAKRY, Aucun 6430, GN",
African mining groupe sarl,,,Mining & Metals,11-50 employees,"CONAKRY, CONAKRY",Privately Held,2010,"GUINEE CONAKRY, CONAKRY, CONAKRY, CONAKRY 224, GN",
DOUM-CONSULTING,http://www.doum-consulting.com,2.25E+11,Management Consulting,2-10 employees,"CONAKRY, GUIN√âE",Sole Proprietorship,2015,"99, CONAKRY, GUIN√âE 99, GN",formations des d√©l√©gu√©s m√©dcaux and Formations des vendeus en pharmacie
Oro Africa,http://www.oro-africa.africa,,Broadcast Media,2-10 employees,,Privately Held,2018,"Conakry , 0000, GN",
EDIFICE Sarlu,http://edifice-guinee.com/,,Construction,2-10 employees,"Conakry, Afrique de l'ouest",Privately Held,2017,"Kip√© Dadia, Carrefour Havana Beach, Commune de dixinn, Conakry, Rep. de Guin√©e, Conakry, Afrique de l'ouest BP 1990, GN",Logistique and BTP
BDEV&Co,,,Management Consulting,2-10 employees,,Privately Held,2015,,"Business Facilitation, Business Consulting, Supply of Private or Shared Workspaces, and Concierge"
224TERRA SARL,https://www.224terra.com/,(+224) 626 65 18 19,Construction,51-200 employees,"Conakry, Conakry",Privately Held,2015,"Bonfi, Commune de Matam , Conakry, Conakry 99, GN","Construction, B√¢timents et Travaux Publics, Genie Civil, Offshoring, and Distributeur exclusif de Terrazyme"
Bon Plan Guin√©e,https://www.bonplangn.com/,,Internet,2-10 employees,"Conakry, Ratoma",Privately Held,,"Ratoma, Conakry, Ratoma 1993, GN",Petites annonces
Z√©ro Pauvre Afrique,http://www.zeropauvreafrique.org,2.25E+11,Civic & Social Organization,"501-1,000 employees","Conakry, Conakry",Nonprofit,2009,"Immeuble SACKO, Camayenne, commune de Kaloum, Conakry, Conakry 00224, GN",D√©veloppement and Urgence Humanitaire
Winners Group Agency (WGA),https://winnersgroupagency.com,+224 629 24 57 34,Professional Training & Coaching,2-10 employees,,Privately Held,2020,"Nongo, Ratoma, Conakry, GN",
Technology Partners' International Group,http://www.tpigrp.com,,Environmental Services,11-50 employees,"Ikeja, Lagos",Privately Held,1992,,
Auto Kaloum,,,Transportation/Trucking/Railroad,0-1 employees,,Privately Held,,"Conakry, GN",
sosthene-nsimba.com,https://www.sosthene-nsimba.com,,Management Consulting,0-1 employees,,Self-Employed,2016,"Nongo, Ratoma, Conakry, GN",
Kinetic Transport Guinee SARL,http://www.kineticguinee.com,,Transportation/Trucking/Railroad,11-50 employees,"Conakry, _",Partnership,2017,"Quartier Kip√©, Commune de Ratoma, Conakry, _ _, GN",
SOGUIMMO,http://www.soguimmo.net,,Real Estate,2-10 employees,"Conakry, Guin√©e",Privately Held,2013,"Kaporo march√©, Complexe Elise, 4√®me Etage, Conakry, Guin√©e 00224, GN",
SUK'ARTS,http://www.sukarts.com,,Media Production,2-10 employees,"Conakry, Conakry",Privately Held,2011,"Commune de Kaloum, Conakry, Conakry 4447, GN","CULTURE, MEDIAS, AUDIOVISUEL, and COMMUNICATION ET MARKETING"
Pacific-Alliance,https://www.pacificalliancegn.com,,Maritime,11-50 employees,"Conakry, Conakry",Partnership,2017,"Madina Concentain, Conakry, Conakry 3718, GN",
EMA Executive Management Africa,http://ema224,,Consumer Goods,0-1 employees,"Conakry, Conakry",Self-Employed,,"Nongo Kaporo Cit√©, Conakry, Conakry 0000, GN",
Kobiri Group,http://www.kobirigroup.com,,Financial Services,51-200 employees,"Kaloum, Conakry",Partnership,,"Kaloum, Conakry 287, GN",
M√©diatis Conseil,,,Marketing & Advertising,2-10 employees,"Conakry, Conakry",,,"Kip√©, commune de Ratoma, Conakry, Conakry 224, GN","Edition & Presse Corporate, Conseil & Strat√©gie marketing, Publicit√©, and Design"
VIMS - SARL,,2.25E+11,Construction,2-10 employees,"Conakry, Lambanyi / Ratoma",Privately Held,2016,"Conakry, Lambanyi / Ratoma GN",
LINBEX Africa,http://www.linbex.com,+224 629 00 42 00,International Trade & Development,11-50 employees,"Conakry, Matam",Partnership,2019,"autoroute Fidel castro, Block A , bureau 126, au Grand march√© de Conakry, Dabondi, Commune de Matam, Conakry, A126, Conakry, Matam 0000, GN",
Laps-store Guin√©e,https://laps-store.com,2.25E+11,Information Technology & Services,11-50 employees,"Matoto, Conakry",Partnership,2016,"Matoto, Conakry GN","√âlectrotechnique, R√©seau informatique, T√©l√©communication, M√©canique g√©n√©rale, Froid et climatisation, Maintenance, Automatisme industrielle, D√©veloppement d'applications web, and Formation"
DEMKA BUSINESS INSTITUTE - DBI,http://www.dbi-gn.com,,Professional Training & Coaching,2-10 employees,,Sole Proprietorship,2019,"Conakry, GN",
Vision Impact Consulting,,,Management Consulting,11-50 employees,"Conakry, Conakry/Matoto",Privately Held,,"Conakry, Conakry/Matoto 01340, GN","Audit, Conseil, Etudes, and Formation"
Groupe EGTT,http://groupe-egtt.com/,00224 622 089 808,Construction,201-500 employees,,Partnership,,"Conakry, GN","Genie Civil, Transport de produits p√©trolier, Genie Rural, and Genie Minier"
,,,,,,,,,
ANAQ-GN,http://www.anaq-edu.org,+224 622-55-55-76,Government Administration,11-50 employees,"Conakry, Ratoma",Government Agency,2017,"Conakry, Conakry, Ratoma +224, GN",Assurance Qualit√©
Cabinet ACAF,http://www.acafexpert.com,2.25E+11,Accounting,11-50 employees,,Privately Held,2015,"Kip√©, Conakry, GN","Audit, Conseil, Assistance comptable, Formation, Consulting, Business plan, Manuels de proc√©dure, Comptabilit√©, Fiscalit√©, and Coaching"
Studio MDesign,http://www.studiomdesign.gn,666732325,Fine Art,2-10 employees,"Conakry, Ratoma",Privately Held,2016,"Lambanyi, Conakry, Ratoma BP : 2398, GN","Infographie, Webdesign, Motion Design, Audiovisuelle, S√©rigraphie, √âv√©nementielle, Marketing, Conseil, Motion design, and Cin√©ma"
FONDATION RBB,http://foundationrbb.com,669393982,Non-profit Organization Management,11-50 employees,,Nonprofit,2018,"Conakry, GN",
DEVEX,https://www.devex-gn.com/,2.25E+11,Research,2-10 employees,"Conakry, Conakry",Partnership,2018,"Conakry, Conakry GN","Etude de march√©, Enqu√™te de satisfaction, Politique et strat√©gie de d√©veloppement, Enqu√™te sociologique, and Formation"
ALL IN ONE GN,,666626666,Construction,11-50 employees,"Conakry, Camayenne commune de Dixinn",Privately Held,2018,"Conakry, Camayenne commune de Dixinn Camayenne, GN","Renovation,Nettoyage,Entretien,Amenagement,Desinfection"
LAGEC,http://www.lagecguinee.com,,Construction,11-50 employees,"CONAKRY, Basse Guinee",Sole Proprietorship,1993,"Kaloum cite chemin de fer, CONAKRY, Basse Guinee 3135, GN",
Afrique Capable,https://acapable.org,2.25E+11,Management Consulting,2-10 employees,,Sole Proprietorship,,"Conakry, GN",
Karo Guin√©e,http://www.karoguinee.com,629404875,Food Production,11-50 employees,"Conakry, Sonfonia centre, rue canal plus",Privately Held,2017,"Conakry, Sonfonia centre, rue canal plus 224, GN",
GUICOTECH,http://www.guicotech.net,2.13E+11,Information Technology & Services,201-500 employees,"Conakry, Guin√©e/Conakry",Partnership,2021,"guin√©e conakry , 58, Conakry, Guin√©e/Conakry 58, GN",
Eqsotech Group,http://www.eqsotech.com,,Information Technology & Services,2-10 employees,"Hamdallaye, Conakry",Partnership,2015,"Immeuble Koula, Route Le Prince , Hamdallaye, Conakry GN","Web Applications Development Software Integration, , Infography & Digital Advertisement, , Software and Hardware Supplier,, Surveillance Camera, , Mobile App development, and Integration and Consulting"
UCOPA sarl,http://www.ucopa-guinee.com,2.25E+11,Food Production,11-50 employees,,Partnership,2018,"conakry madina c/matam , conakry, GN",
Engineering and Supply Experts,http://www.engineeringandsupplyexperts.com,2.25E+11,Mechanical Or Industrial Engineering,11-50 employees,,Sole Proprietorship,2020,"Guinee, Kamsar, Camp Balanta, GN",
Entreprise Africaine de Maintenance et de Service,http://contact@eamsguinee.com,,International Trade & Development,11-50 employees,"Conakry, Guin√©e Conakry",Sole Proprietorship,2009,"contact@eamsguinee.com, Rue KA008,2e Avenue Boulbinet,Commune de kaloum/Dixinn √©cole Bp 4661 conakry, Conakry, Guin√©e Conakry +224, GN",
Pacioli Inc,,2.25E+11,Accounting,2-10 employees,,Partnership,2020,"Nongo, Conakry, GN","Accounting, Assurance , Tax, Advisory, and Training"
JamaaShop,https://www.jamaashop.com,33760025005,Retail,2-10 employees,,Privately Held,,"Conakry, GN",
Association Oeil sur les Enfants,http://www.oeilsurlesenfants.wordpress.com,,Civic & Social Organization,2-10 employees,"Conakry, Taouyah",Nonprofit,2017,"Jean-Pau 2, Conakry, Taouyah 3212, GN","Droits de l'Homme, Education des Enfants, Protection de l'enfance, Promotion de l'Enfance, and Leadership associatif"
Group Delta Log,https://groupdeltalog.com/,+224 622 35 12 12,Automotive,51-200 employees,,Privately Held,,"Raton Bonfi, Commune de Ratoma , Conakry, BP 5757, GN","Garage moderne, Vente et location de v√©hicules, Centrale d'achat, Vente de pi√®ces de rechange, Transports miniers, and Vente de lubrifiants"
KS-PAY,http://www.ks-pay.com,,Financial Services,2-10 employees,"Conakry, Guin√©e",Privately Held,2016,"commune de Ratoma, Conakry, Guin√©e 0000, GN","Paiement mobile, Transfert d'argent national et international, Distribution du cr√©dit t√©l√©phonique tout op√©rateur, and Paiement en ligne (e-commerce)"
Index Com,,+224 622 26 66 33,Printing,2-10 employees,"Conakry, Conakry",Privately Held,2018,"+224, Conakry, Conakry +224, GN","Impressions haute gamme, Conception professionnelle, R√©gie publicitaire, Conseil et √©laboration de strat√©gie marketing, Prestation de services, √©v√©nementiel, Identit√© visuelle, Charte graphique, and Vid√©os entreprise"
Digit Propulse,https://digit-propulse.com/,(224) 627 522 984,Marketing & Advertising,0-1 employees,,Self-Employed,2017,"CONAKRY, GN","Marketing Digital, Inbound Marketing, SEO, Content Marketing, Community Manager, Communication Digitale, Site Web Wordpress, Web Analytics, Marketing Automation, and Facebook Experts"
GOLD AND DIAMOND SUPPLY RESORT,,,Mining & Metals,"5,001-10,000 employees",,Sole Proprietorship,,"Conakry, GN",
COMPANIA NACIONAL DE PETROLEOS DE GUINEA ECUATORIAL,,,,,,,,,
WCFA S&A,https://www.wcfasa.africa,+224 662141492,Construction,2-10 employees,,Privately Held,1999,"Lansanaya Takoui, Commune de Matoto, Conakry, GN","Energie, Construction, Technologie Numerique, Restauration, Bien & Services, Commerce, Shipchandlers, Batiment, IT Support, G√©nie Civil, and Electricit√©"
Southern Rivers Commodities,,+224 625 210 110,Utilities,11-50 employees,,Partnership,2017,"Conakry, GN",
Envirocom S.A.R.L.,http://www.envirocom-gn.com,,Renewables & Environment,2-10 employees,"Conakry, Conakry",Privately Held,2013,"Lansanayah, Conakry, Conakry BP3277, GN","Environment Management, Social Sustainability, Environmental Impact Assessment, CSR, Civil Engineering, Water and Sanitation, Community Development, Water Resources, GIS, and Business"
ALMO,http://www.almo.com,2.25E+11,Real Estate,2-10 employees,"Conakry, R√©p. Guin√©e",Privately Held,2019,"Lambanyi, Conakry, R√©p. Guin√©e 0000, GN",Achat de terrain and Location de terrain
Les Jeunes Ambassadeurs de l'Environnement pour le Developpement Durable,,,Non-profit Organization Management,2-10 employees,,Nonprofit,2017,"Wanindara T5/commune de Ratoma, Wanindara T5 carrefour Dinabodji/ Ratoma, BP6009, GN","Bien et Services, Sensibilisations, Collecte des fonds, S√©minaires, Ev√®nements, Bien-√™tres; Formation et Accompagnement."
METAIR Solutions,http://www.metairsolution.com/,,Logistics & Supply Chain,11-50 employees,"Conakry , Conakry",Privately Held,2016,"Kipe Transversale 2, Conakry , Conakry 30 BP 4, GN","Transport, Logistique, Approvisionnement, Voyages et Hebergement, and Customs Broker"
Douane Guin√©enne,https://www.dgd.gov.gn,,Government Administration,"501-1,000 employees",,Government Agency,,"Conakry, 00224, GN",
CFPA GROUP,https://www.facebook.com/CFPAgn/,2.25E+11,Professional Training & Coaching,2-10 employees,"Conakry (Conakry, Guinea), Kindia",Sole Proprietorship,2019,"Guin√©e, Conakry (Conakry, Guinea), Kindia 001, GN","Librairie, formation, coaching, accompagnement, agence de recrutement, and recommandation"
Magicguinee,http://magicguinee.com/,626060665,Logistics & Supply Chain,11-50 employees,"cnakry, conakry",Partnership,2016,"cnakry, conakry 00224, GN","Cousier, Livraions, Conciergerie, marchandise, Facture, and courrier"
IntelDeci,http://www.Inteldeci.com,,Information Technology & Services,11-50 employees,"Conakry, Conakry",Privately Held,2015,"Taouya, Conakry, Conakry GN","Formation et Certification CISCO, Solutions Business Intelligence et Consultation., Traning and Certification CISCO, BI solutions and Consulting, Microsoft BI, Tableau, Talend, Tableur, and Spreadsheet"
West Entreprise,http://www.gwestco.com,,Logistics & Supply Chain,11-50 employees,"Conakry, Basse Guin√©e",Privately Held,2016,"Matam, Route Niger Km9, Conakry, Basse Guin√©e BP 1025, GN",Supports Logistiques
Divertix,http://www.magicpark-gn.com,,Animation,2-10 employees,"Ratomo, Conakry",Public Company,,"Ratomo, Conakry 612, GN",
Danapuri Guinea SARL,https://www.danapuri.com/,+224 627 86 89 98,Information Technology & Services,11-50 employees,,Privately Held,2019,,"Project Investment & Management, E-Government, Trusted Identity, E-Commerce, E-Payment and E-Financial Services, and Technology Adoption"
START THE CHANGE - Donnons le sourire,,+33 7 58 86 11 90,Non-profit Organization Management,11-50 employees,"La Courneuve, √éle-de-France",Nonprofit,2018,,
Medab Shore Guinee,http://www.medabshore.com,+224 628 36 86 29,Telecommunications,11-50 employees,"Conakry, Dixinn Centre en face du night club Galaxie",Privately Held,2020,"Conakry, Dixinn Centre en face du night club Galaxie GN",
DEEP MEDIAS,http://www.deepmedias.com,,Online Media,2-10 employees,"Conakry, Conakry",Sole Proprietorship,2017,"Dixinn Centre I, Conakry, Conakry 6629, GN","ORGANE DE PRESSE, R√âGIE PUBLICITAIRE, and MARKETING DIGITAL"
Skylard Group,http://www.skylardgroup.com,,Internet,2-10 employees,"Conakry, Conakry",Privately Held,2016,"Enta-Fassa, Commune de Matoto, Conakry, Conakry 4253, GN","D√©veloppement web & mobile, Internet, and Livraison de plats de restaurant"
Worked No Played,,,,,".., ..",,,".., .., .. 352323, GN",
Albumartec,http://www.albumartec.com,,International Trade & Development,2-10 employees,"Conakry, Conakry",Partnership,2012,"Dixinn, Conakry, Conakry GN.DX, GN","Technologies de l'information, Construction, Technique, Pneus OTR & Vulcanisation, Environnement, and Efficience √©nerg√©tique"
K.I.B Consulting,https://www.kib-consult.com,+224 625 480 442,Management Consulting,2-10 employees,"Conakry, Kaloum",Privately Held,2009,"Conakry, Kaloum GN",
GCI CONSEIL,,2.25E+11,Financial Services,2-10 employees,"CONAKRY, GUINEE",Privately Held,2020,"KAPORO ROUTE LYCEE FRANCAIS, CONAKRY, GUINEE BP 0000, GN",
KOWO,http://agencekowo.com,,Marketing & Advertising,,,,,,
SOGUIDI,http://soguidi.com/,00224 620 69 58 55,Import & Export,2-10 employees,,Sole Proprietorship,2012,"BP 24 Rue Kaloum, Conakry, R√©p. de Guin√©e, Conakry, GN",
Doddel Free,https://www.doddel.co.za,,Online Media,,,,,,
Innova-Tek,http://www.innova-tek.com,,Oil & Energy,11-50 employees,"Conakry, Conakry",Privately Held,,"Route de Lambanyi, face Centre Commercial, Conakry, Conakry BP 4794, GN","‚Ä¢ Project Controls & Project Procurement Management, Oil & Gas - Mining equipment and services, LV & MV electric equipment, UPS & Energy management, and Fleet management, VOIP & IPBX"
Julius Nyerere University of Kankan,http://www.ujnk.org/,,,,,,,,
