Company Name,Website,Phone,Industry,Company Size,Headquarters,Type,Founded,Location,Specialties
UNIAYD,http://www.uniayd.com,2.25E+11,Education Management,2-10 employees,,Privately Held,2021,"Avenue Toubman, Q/ Almamyah, C/ Kaloum, Immeuble BOBO, Conakry, 6316, GN","Study Abroad, University Admission, Etudier √† l'√©trang√®re, and Education Consultancy"
Centre d'Appui aux Petites et Moyennes Entreprises(CAPME),,,Government Administration,2-10 employees,,Government Agency,2021,"Conakry, GN",
Le Karamokoein,,+224 624994294,Mobile Games,2-10 employees,"Conakry, Conakry",Self-Employed,2021,"Conakry, Conakry 99330, GN","Education, psychomotricit√©, coaching parental, and coaching scolaire"
MASIT,,2.25E+11,Management Consulting,2-10 employees,,Sole Proprietorship,,"Conakry, GN",
PIPS ACADEMIA,,623554524,Professional Training & Coaching,11-50 employees,,Partnership,2019,"Conakry, 000000, GN",
Guimmo Services | Terrains,http://guimmoserv.com,,Real Estate,,,,,"Conakry, GN",
Groupement Dina-Caat,,2.25E+11,Architecture & Planning,201-500 employees,"Conakry, Guin√©e",Partnership,2018,"3402, appartement, Conakry, Guin√©e +224, GN","Architecture , Ing√©nierie, and Urbanisme"
Magala - CyberSecurity,,,Computer & Network Security,11-50 employees,"Conakry, Nongo / Commune de Ratoma",Self-Employed,2021,"Conakry, Nongo / Commune de Ratoma GN",
HeyKouame,,+224 625 397 618,Computer Software,2-10 employees,"Conakry, Guin√©e",Sole Proprietorship,,"Conakry, Guin√©e 224, GN",
Nekomathal-TECH,,2.25E+11,Marketing & Advertising,2-10 employees,"Conakry, Ratoma",Self-Employed,2021,"130, Conakry, Ratoma GN","Publicit√©, Site web, Vente des appareils √©lectroniques, Confection des affiches publicitaires, Logo, CV professionnel, and Vid√©o de publicit√© anim√©e"
Kalibori Consulting,,,Financial Services,2-10 employees,,Privately Held,2020,"Conakry, GN",
Guin√©e Rail Multiservices,https://guineerailms.com,2.25E+11,Civil Engineering,11-50 employees,"Kamsar, Bok√©",Privately Held,2021,"Kamsar, Bok√© GN","Chemin de Fer, les voies ferr√©es, Construction voie ferr√©e, √©quipement roulant, Fourniture de mat√©riel, Maintenances de voie et installation, Sant√© S√©curit√© Environnementale, Genie civil, S√©curit√© ferroviaire, Conception et r√©alisation de projet, BTP, ballast/b√©ton, Traverses, Rails, and Appareils de voies"
Polymetals Resources Ltd,http://www.polymetals.com,,Mining & Metals,11-50 employees,"Sydney, NSW",Public Company,,,"Gold Mining, Mining, and Mineral Exploration"
LONAGUI,https://lonagui.com.gn/,,Gambling & Casinos,201-500 employees,"Conakry, Guin√©e",Public Company,2000,"Commune de Dixinn, mini√®re, Conakry, Guin√©e OOOO, GN",
Global Agriculture Development Business Trust,http://glagd.com,,Farming,"10,001+ employees","Nakuru - East, Kenya",Privately Held,2014,,"Custom Co-operative Development, Agricultural Production, Agricultural Processing, Agriculture Operations, Agricultural Training, Agriculture Equipment Manufacturing, Agricultural Product Distribution, Global Agricultural Trade, Trade Development, and Agricultural Logistics"
Association Jeunes Scientifique AJS,http://www.ajsi.org,+224 622616030,Philanthropy,11-50 employees,,Nonprofit,2017,"Conakry , GN",
Africa Solutions,,00224-661-10-40-40,Logistics & Supply Chain,51-200 employees,"Conakry, Kaloum",Partnership,2018,"Almamya , Angle Rue KA 040 et 6√®me boulevard Kaloum, Conakry, Kaloum 2927, GN","Transport, Communication, N√©goce, Immobilier, and Logistique"
SACAM GROUP,http://www.sacamgroupe.com,622757660,Transportation/Trucking/Railroad,11-50 employees,,Privately Held,2020,"Tombolia plaque , Imeuble Mousoko, 2√® Etage, CONAKRY, 224, GN",
Eleis Farm,http://www.eleisfarm.com,,Farming,2-10 employees,"Soussoude, Bok√©",Privately Held,2013,"Eleis Farm, Soussoude, Bok√© 0000, GN","Sustainable Farming, Women Empowerment, Sustainable Palm Oil, Black Soap, Ecotourism, Social Impact, Agriculture, African Trade, and Import/Export"
Colow-so Guin√©e Conakry,https://www.colow-so.com,,Financial Services,,,,,"Conakry, Conakry, GN",
Ciments de Guin√©e,,,,,,,,,
Dechets a l'Or,http://www.dechetsalor.com,,Environmental Services,11-50 employees,"Kankan, Upper Guinee",Privately Held,2015,"Kankan, Upper Guinee GN","Waste Management, Community Engagement, and Tech"
EGUITRA GROUP SARLU,http://www.eguitragroup.com,669 13 13 33,Transportation/Trucking/Railroad,2-10 employees,,Partnership,2020,"Conakry, GN","Transport et Logistique, Agriculture et Elevage, Construction et Immobilier, Commerce Generale, and Formation et Coaching"
MARIFALA INDUSTRIE,http://www.groupemarifala.com,,Furniture,,,,,"Bambet, Conakry, Guin√©e 00224, GN",
Sokomak,http://www.sokomak.com,,Internet,2-10 employees,,Partnership,2020,"Conakry, GN",
Groupebceip,http://www.groupebceip.com,,Individual & Family Services,"1,001-5,000 employees","Conakry, commune de ratoma",Privately Held,1996,"Conakry pres du pont de la j√©t√©e mini√®re commune de Ratoma, siguiri- kankan - kagbelen- kamsar- N'Zerekore, Conakry, commune de ratoma 1850, GN","insertion professionnelle des jeunes, securite et gardiennage, creation de projet, and gestion immobiliere"
Alternative Solutions,https://www.altsolconseil.com/,,Information Technology & Services,2-10 employees,"CONAKRY, CONAKRY",Partnership,2017,"KIPE DADIA, CONAKRY, CONAKRY 0000, GN",
TLOTS Fondation,,+224 622616030,Philanthropy,"10,001+ employees",,Educational Institution,2018,"Conakry , GN",
ANSSI Guin√©e,http://www.anssi.gov.gn,2.25E+11,Computer & Network Security,201-500 employees,"Conakry, Conakry",Government Agency,2016,"Manquepas 3√®me avenue, 7√®me ETAGE, Conakry, Conakry 5000, GN",Cybers√©curit√©
EAMS Ascenseurs,http://www.eamsguinee.net,2.25E+11,Industrial Automation,11-50 employees,,Privately Held,2009,"4661 Conakry, Rue KA008, 2e Avenue Boulbinet, Conakry, GN",ETUDE - CONSEIL - FOURNITURE - INSTALLATION DES ASCENSEURS ET AUTOMATISMES DE PORTES
Alstraf & Partenaires Sarl,https://web.facebook.com/alstrafetpartenaires,654899387,Farming,2-10 employees,"Conakry, Ratoma",Privately Held,2019,"3104 Conakry R√©publique de Guin√©e, Conakry, Ratoma 3104, GN","Agriculture , Construction, B√¢timents Travaux Publics, Transports, Commerce, and Prestation de services"
Assembl√©e nationale de Guin√©e,http://www.assemblee.gov.gn,,Government Administration,"501-1,000 employees",,Government Agency,1958,"BP 414 C/Kaloum, Conakry, GN",Voter les lois and Contr√¥ler l'action gouvernementale
finadev,http://finadev-groupe.com,,Marketing & Advertising,,,,,,
Collectif des Associations de Guin√©e,http://www.coagui.org,2.25E+11,Philanthropy,11-50 employees,,Nonprofit,2015,"Conakry , GN",
GAS Guin√©e,https://jeankone2.wixsite.com/gas-guinee,,Logistics & Supply Chain,201-500 employees,"Conakry, Etat",Partnership,2016,"0224, Kip√© , Conakry, Etat 01, GN","Transport & Logistique, BTP, Fourniture des √©quipements, Conseil & Formation, D√©pannage et Maintenance Engins"
SETA MOTORS,http://seta-motors.com,+224 629 00 62 73,Automotive,51-200 employees,,Privately Held,1989,GN,"SALES, AFTER-SALE, CAR, and TRUCK"
Danta-international Guinea,http://www.danta-international.com,,Business Supplies & Equipment,2-10 employees,,Sole Proprietorship,2011,,
Adam Print,,+224 623 98 59 14,Consumer Services,2-10 employees,,Partnership,2018,"Conakry kaloum , Conakry, GN",Graphisme et Impression sur Textile
SOGUIAM SARL,https://www.soguiam-guinee.com,2.25E+11,Construction,2-10 employees,,Partnership,2020,"Si√®ge Social : Gomboyah March√© Carrefour SODEFA, Sous-pr√©fecture de Man√©ah Pr√©fecture de Coyah T√©l (+224) 622 25 08 66 / 656 96 00 71 /622 40 50 89, E-mail : soguiamguinee@gmail.com Conakry, Conakry, GN",
CABINET LOMBONNA SARL,http://www.cabinet-lombonna.com,,Accounting,11-50 employees,,Privately Held,1985,"4 √©tage Immeuble Ch√©rif Diallo, Conakry, GN","AUDIT, EXPERTISE, LEGAL & TAX, HUMAN RESSOURCES, and ADVISORY"
Big Iron Parts Logistics,http://www.bip-logistics.org,+1 3478811850,Logistics & Supply Chain,11-50 employees,"Conakry, Ratoma",Privately Held,2012,"Lambayi, Ratoma, Conakry, Ratoma 00000, GN",
African Crisis Group,http://www.africancrisisgroup.org,,International Affairs,11-50 employees,"Conakry, Conakry",Nonprofit,2011,"Commune de Ratoma, Conakry, Conakry BP 4864, GN","Conflict and Crisis Resolution, Peace-building, Risk Assessment and Monitoring, Good governance, and Consulting"
MoDeL - Guin√©e,http://modelguinee.org/,,Political Organization,"10,001+ employees","Conakry, Guinee",Public Company,2018,"Nongo, Conakry, Guinee GN","politique, leader, democratie , and guinee election"
COPE GUINEE,http://www.economie224.com,,Civic & Social Organization,11-50 employees,"Conakry, Guin√©e",Privately Held,,"2489, Conakry, Guin√©e 2489, GN",
Dama Africa Logistic (DAL),https://damaafricalogistic.com,2.25E+11,Logistics & Supply Chain,11-50 employees,,Privately Held,2013,"Nongo, Conakry, GN",
REB (R√©seau Environnement Bauxite),https://www.rebgn.org/,,Renewables & Environment,2-10 employees,,Nonprofit,,"conakry, guinee, conakry, GN",
Education Services,http://eserv.org,,Management Consulting,2-10 employees,"Conakry, Conakry",Nonprofit,2016,"Lambangny, Ratoma, Conakry, Conakry 1038, GN",Accompaniment of African schools at primary and secondary level
Mesbellesenvies,http://www.mesbellesenvies.fr/,,Consumer Services,2-10 employees,"Conakry, Conakry",Sole Proprietorship,2019,"Conakry, Conakry 1275, GN","Achats, Livraison, Logistique, Approvisionnement, Guin√©e, and Transport"
Centre Konkour√© - Guin√©e solidarit√© Provence,https://guineesolidarite-pr.org/,+224 664 30 38 76,Professional Training & Coaching,11-50 employees,,Privately Held,2006,"P√©tel 2, km 4, Mamou, GN",
Constat Client,http://www.constatclient.com,2.25E+11,Research,2-10 employees,"Conakry, Matoto",Partnership,,"Conakry, Matoto GN","Mystery Shopping, Exp√©rience client, Satisfaction client, Etudes marketing, Visites myst√®res, Appels myst√®res, Internautes myst√®res, Etudes concurrentielles, Customer survey, Formation, and Conseils"
Association des Blogueurs de Guin√©e (ABLOGUI),http://www.ablogui.org,,Internet,11-50 employees,,Nonprofit,2011,,"M√©dias Sociaux, Plaidoyer, Promotion Langue Nationale, and Bonne Gouvernance"
Djoma Holding Mining Guinea,http://www.Djomaholdingminingguinee.com,,Mining & Metals,2-10 employees,"Conakry , Ratoma",Privately Held,2015,"Kaporo Market , 1 floor, Conakry , Ratoma 1234, GN",Gold Mining and Exploration
WELHY,http://www.welhy.com,,Hospitality,11-50 employees,"Conakry, Guinea",Privately Held,2018,"Kaporo, Conakry, Guinea 3141, GN",
FMD Empire,,666 730 333,Retail,2-10 employees,"Conakry, Matoto",Sole Proprietorship,,"Conakry, Matoto GN","Mat√©riels informatiques , Consommables informatiques, T√©l√©phones & accessoires, Fournitures de bureau, and Divers"
allo224 - Service de Livraison,http://www.allo224.com,,Restaurants,,,,,"Kip√© Carrefour Havana, Commune de Ratoma, conakry, conakry 224, GN",
Global Opportunities - GLOOPP,http://www.gloopp.com,,Public Relations & Communications,0-1 employees,,Nonprofit,2021,"224, Conakry, GN",
Make Every Woman Count,https://mewc.org,,Civic & Social Organization,2-10 employees,,Nonprofit,2010,"Conakry, GN",
Entrepreneur World,,+224 621 974 140,Online Media,2-10 employees,,Sole Proprietorship,2019,"Conakry, GN","Brand Content, Presse en ligne et √©crite, Ev√©nementiel, Cr√©ation de contenu, Marketing, Annuaire, Boutique, Formation, and R√©gie Publiciataire"
Edify Informatics Value Solution and Services,https://www.eivss.com,9.19E+11,Computer Software,11-50 employees,"BANGALORE, Karnataka",Privately Held,2019,,
Nadhel Real Estate,,,Real Estate,2-10 employees,"Dakar, Dakar",Privately Held,2018,,"Property developement, Real Estate, Promotion immobili√®re, Asset management, Assitance √† Maitrise d'Ouvrage, Maitrise d'Ouvrage d√©l√©gu√©e, Property Management, Investissement immobilier, R√©sidentiel, Commercial, Tertiaire, Gestion de Portefeuille, logement social, Immobilier, Hotellerie, Am√©nagement, D√©veloppement Immobilier, and Bureaux"
Consolidated Mining Corporation,http://cminingcorp.com,,Mining & Metals,11-50 employees,,Privately Held,,GN,"mining, bauxite, and gold"
MARKET GUINEE,http://www.marketguinee.com,,Online Media,2-10 employees,,Sole Proprietorship,2017,"Koloma soloprimo, Conakry , GN","annonce , emploi , logement , v√©hicules , and services"
Securis Africa,http://securisafrica.com,,Business Supplies & Equipment,11-50 employees,"Conakry, Not Applicable",Privately Held,2006,,"Mobile Asset Tracking, Security, GPS Solutions, Security Systems, Alarm, Personnal Protective Equipment, Fleet Management, and RFID Solutions"
SAREF INTERNATIONAL,http://www.sarefinternational.com,2.25E+11,International Trade & Development,201-500 employees,"Conakry, Conakry",Self-Employed,1980,"Conakry, Conakry BP 3915, GN","EQUIPEMENT PETROLIER, EPI, SECURITE INCENDIE, PROMOTEUR IMMOBILIER/ CONSTRUCTION DE BATIMENTS, and AGRO-CHIMIQUE"
BANKIDRIVE,http://bankidrive.com/,,Transportation/Trucking/Railroad,,,,,"CONAKRY, Ratoma GN",
Cabinet Dry Consulting,,656215579,Professional Training & Coaching,2-10 employees,"Conakry, Guin√©e",Self-Employed,2020,"Conakry, Guin√©e GN",
Group DeltaLog Guinee,http://www.groupdeltalog.com,,Automotive,51-200 employees,"Conakry, Conakry",Privately Held,2000,"Ratoma Bonfi, Commune de Ratoma, Conakry, Conakry BP 5757, GN",
Orashi Africa,http://www.orashi-international.com/orashi-africa/,,Logistics & Supply Chain,51-200 employees,"Conakry, Almamya",Privately Held,2014,"Guinee, Conakry, Almamya GN","Heavy & Industrial Equipment, Operations & Maintenance, Logistics & Transportation, Industrial & infrastructure project management, and Spares parts"
Entre Nous TV,http://www.entrenous.net,,Information Technology & Services,2-10 employees,,Self-Employed,,,Blogging and Web
Monarch Academy,http://www.academy-monarch.com,,Professional Training & Coaching,2-10 employees,,Educational Institution,2020,"Kaporo Centre, Conakry, GN",
Sacko Mining,http://www.sackomining.com,,Mining & Metals,51-200 employees,"Conakry, Conakry",Privately Held,2014,"Camayenne - Comunne Dixinn, Conakry, Conakry BP6318, GN",
C2M GROUP SA,https://c2mgroup-gn.com/,2.25E+11,Management Consulting,51-200 employees,"Col√©ah corniche sud , Conakry, R√©publique de Guin√©e.",Privately Held,2019,"Col√©ah corniche sud , Conakry, R√©publique de Guin√©e. GN",
Agence B2B Ouest Africaine,,,Marketing & Advertising,11-50 employees,,Privately Held,2016,,"Linkedin, Digital marketing, B2B, Senegal, Cote d'Ivoire, Influenceur, Personnalit√©, Star, B√©nin, Mali, Business, Capitaine d'industrie, Leader, Social networks, and Community Management"
Rideen,https://rideen.com/,2.25E+11,Individual & Family Services,2-10 employees,,Partnership,2019,"R√©sidence Cameroun, Conakry, BP602, GN",
OumLamguin√©e,,+224 662 74 78 10,Renewables & Environment,2-10 employees,"Conakry, Bambeto",Sole Proprietorship,2020,"Conakry, Bambeto GN","Electricit√© b√¢timent, Informatique, graphisme, formation, conseil, maintenance, recyclage, pav√®s, briques, tuiles, and marketing"
Trustee sas,http://www.trustees.fr,2.25E+11,Investment Management,2-10 employees,"Tombo, Guin√©e",Privately Held,2018,"Tombo, Guin√©e 00000, GN","Venturing, Incubateur, startup, Finance, and Acc√©l√©rateur"
"Hann Consulting ""HC""",,(+224)666-131-615,Management Consulting,2-10 employees,,Sole Proprietorship,2020,"Conakry, GN","management, Ressources Humaines, Emploi, Conseils, Formations, Coaching, Creation d'entreprise, Developpement Personnel, and Recrutement"
SDI,,,Information Technology & Services,2-10 employees,"Conakry, Conakry",Sole Proprietorship,2017,"R√©publique de guin√©e, commune de Matoto, quartier Tan√®n√® March√©, Conakry, Conakry 1654, GN",Digitales et informatiques
Ouskei Consulting,http://www.ouskeiconsulting.com,+224 657390107,Management Consulting,11-50 employees,"Conakry, Ratoma",Privately Held,2017,"Conakry, Ratoma 3553, GN",Global management consulting and Advisor on business Strategy
TAFORY | Trouver des Logements en Guin√©e. Real Estate in Guinea.,,,Real Estate,2-10 employees,,Partnership,2011,"Conakry, Conakry, GN","Real Estate, Hotels, Accomodation, Estate Agency, Internet Marketing, and Internet"
ETI - IDENTIFICATION & SECURISATION BIOMETRIQUES,,,Government Administration,,,,,"5675 Boul√©vard du commerce , Conakry, Guin√©e 224, GN",
Pareto University,http://www.paretouniversity.com,,Higher Education,51-200 employees,"Conakry, Guinea",Educational Institution,2016,"Avenue de Prince - Ratoma, Conakry, Guinea GN",Higher Education
Primus Hotel Kaloum,http://www.hotelkaloum.com,,Hospitality,201-500 employees,,Privately Held,,"Almamya, Avenue de la R√©publique, Kaloum, Conakry, 1199, GN",
Business Marruecos-Magreb /AFRICA.@Pedro Verdasco & Partners,http://web.facebook.com/UE.MAROC.AFRIQUE,,International Trade & Development,,,,,,
ACF AUTOMOBILE GUINEE,https://web.facebook.com/pg/ACF-AUTO-221508692457188/about/?ref=page_internal,621244774,Automotive,2-10 employees,"Conakry, Conakry",Privately Held,2017,"639 Guinea Conakry, Conakry, Conakry 001, GN","location de v√©hicule, location de voiture, location longue dur√©e, vente de voiture, and vente de v√©hicule"
Bluezones Guin√©e,http://www.guinee2020.com,,Government Administration,11-50 employees,"Conakry, Guin√©e/Conaky",,2014,"Commune de Kaloum, Almamya/Kaloum, Conakry, Guin√©e/Conaky 3177, GN",
Italia Box,http://facebook.com/italiaboxconakry,627125555,Restaurants,2-10 employees,,Sole Proprietorship,2019,"Italia Box Camayenne , Conakry , GN",
The D-Corp. SARL,https://www.thedcorp.com,+224 628 99 80 55,Information Technology & Services,11-50 employees,,Privately Held,2011,"Kip√©, √† cot√© de M√©tal Guin√©e, Conakry, 560, GN","Branding, Technologie, Badges, and Construction"
Sellem Industries,http://www.sellemindustries.com,,Mining & Metals,11-50 employees,"London, London",Privately Held,2013,,"Gold mining, Gold Trading, Gold Refining, and Artisanal Mining"
Soci√©t√© G√©ologie Mini√®re SARL,https://web.facebook.com/SocieteGeologieMiniere,2.25E+11,Mining & Metals,"501-1,000 employees","Conakry, Bok√©, Siguiri, Labe, Conakry",Privately Held,2016,"Conakry Kaloum, Manquepas Immeuble Zaidan a cot√© de l`Ambassade de France , +224654666666, Conakry, Bok√©, Siguiri, Labe, Conakry 2415, GN","Mining, Drilling, Exploration, Exploitation, and Guinea"
VIGP GUIN√âE / S√âN√âGAL,,33761612127,Real Estate,2-10 employees,,Partnership,2020,"CONAKRY / KALOUM, CONAKRY, GN",
Eclosion,,221 77 639 04 24,Professional Training & Coaching,0-1 employees,"Dakar, Dakar",Sole Proprietorship,2019,,"Management et Leadership, D√©veloppement des Ressources Humaines, Assesment, Coaching individuel, Coaching de Managers, Coaching d'√©quipe, and Formation"
Jobs Guinea,,,Human Resources,2-10 employees,,Privately Held,,"En VIlle, Conakry, GN","ressources humaines, recrutement, and emploi"
Riviera Guinee,http://rivieraroyalhotel.com,,Hospitality,201-500 employees,,Sole Proprietorship,2001,"BP 1708, conakry, GN",
Krysecu,https://krysecu.com/,+224 625 04 50 22,Information Technology & Services,2-10 employees,"Conakry, Kaloum",Privately Held,2021,"Immeuble Satguru, En face du Minist√®re de la Coop√©ration, Conakry, Kaloum GN",
MDS CONSULTING,,,Management Consulting,2-10 employees,"Conakry, Conakry",Privately Held,2017,"Kaloum, Conakry, Conakry 224, GN","assistance comptable et fiscale , contr√¥le de gestion , management strat√©gique, audit op√©rationnel, management des projets , formation , cr√©ation d'entreprise, √©tude de march√©, manuel de proc√©dure , finance, tableau de bord, and carte strat√©gique"
Guinapres,,625 63 18 18,Construction,2-10 employees,,Partnership,2015,"224, Bok√©, GN","BTP, Am√©nagement, and Construction"
OMEGA Consulting Firm,,+224 655086508,Design,2-10 employees,"Conakry, Guin√©e",Partnership,2018,"Conakry, Guin√©e GN","communication, marketing, relation publique, and commercial"
SAFRICAR,http://www.safricar.com,,Insurance,2-10 employees,"Conakry, Conakry",Partnership,2002,"Almamya, Conakry, Conakry 5943, GN","Courtages, Assurances et R√©assurances, Audits d'Assurances, and Conseils"
ERICINES SERVICES,http://www.ericinesservices.com,+224 622 41 19 53,Business Supplies & Equipment,2-10 employees,"Conakry, Conakry",Privately Held,2012,"6 Avenue, Conakry, Conakry 3811, GN",
SIAF Group,https://www.siafgroup.com,+1 212 618 1321,Management Consulting,2-10 employees,"New York, NY",Partnership,2019,,
Integrated Project Alliance,http://www.integratedprojectalliance.com/,,Construction,11-50 employees,,Privately Held,,,
SOCIETE GRAVUPUB GUINEE SARL,http://www.gravupub.com,,Marketing & Advertising,11-50 employees,"CONAKRY, Basse Guin√©e",Partnership,2010,"BP 2486 CONAKRY REP.DE GUINEE, CONAKRY, Basse Guin√©e 2486, GN",Agence de publicit√©
GROUPE GUINEE VOYAGES PLUS SERVICES,http://www.groupeguineevps.com,620891933,"Leisure, Travel & Tourism",51-200 employees,"Conakry, Base guin√©e",Privately Held,,"Conakry, Base guin√©e 5842, GN",
EUROACTIV - Commercial Real Estate Services Africa,http://www.euroactiv.pt,3.52E+11,Real Estate,2-10 employees,"Lisbon, Lisbon",Privately Held,2007,,"real estate, european citizenship, africa, corporate real estate, investment, valuations, capital markets, and masterplanning"
ELECTROMATIC GUINEE,http://www.electromaticguinee.com,,Construction,11-50 employees,,Privately Held,2013,"Coleah - Route du Niger - Face √† la BICIGUI, Conakry, GN",
Tiakpa Olivier Dore,http://www.tiakpaolivier.com,2.25E+11,Investment Banking,0-1 employees,,Sole Proprietorship,2020,"Conakry Guin√©e, Conakry, Conakry, GN",Fonds Sp√©culatif
PMC Afrique,http://www.pmc-afrique.com,2.25E+11,Management Consulting,2-10 employees,"Conakry, Ratoma",Partnership,,"Kip√© Centre √âmetteur, Conakry, Ratoma BP 15, GN",
Afri Gold Guin√©e S.A.R.L,https://www.afrigoldguinee.com,,Mining & Metals,201-500 employees,"Conakry, R√©publique de Guin√©e",Sole Proprietorship,2009,"Conakry, R√©publique de Guin√©e 224, GN",
OUSTRANS LTD - Ousmane Translation Services Limited,,,Translation & Localization,2-10 employees,,Self-Employed,2004,"Tombolia, Conakry, 00224, GN","Translation Services (French & English), Transcription in Nko, Arabic and Roman ( Mandingo, Pular, Susu, Kissi, Guerze), Proofreading / Revision / Editing, and Teaching of French, English and local Languages)"
Sheringham P and I Services,http://www.relugasmarine.com,2.33E+11,Maritime,2-10 employees,"Tema, GAR",Public Company,,,
Butterfly Business Corporate SARLU,https://butterflybusinesscorporate.websites.co.in/,620414256,Marketing & Advertising,2-10 employees,"Conakry, Conakry",Privately Held,2017,"Guin√©e, Conakry, Conakry 030BP68, GN","MultiMedia - , Immobilier , Marketing , and Ev√©nementielle"
Satguru Agence De Voyage GUINEA (CONAKRY),https://satgurutravel.com/guinea/,+224 627272607,"Leisure, Travel & Tourism",51-200 employees,"conakry, conakry",Privately Held,1989,"Visage Satguru Immeuble, Ambassade de Allemagne, conakry, conakry 1988, GN","R√©servation d'hotel, MICE, Services de visa, Location de v√©hicule, Forfait de voyage, Assurance voyage, Transfert A√©roportuaire, and Assistance de Visas"
Moria Tradind sarl,,,Import & Export,2-10 employees,,Privately Held,2008,,Import-Export and N√©goce
GivaGro,http://www.givagro.com,2.25E+11,Farming,0-1 employees,"Conakry, Guin√©e",Sole Proprietorship,2019,"Conakry, Guin√©e 1454, GN","commerce de d√©tails, service agricole, agroalimentaire, production agricole, legumes, and fruits"
AFRIPARservices,,2.25E+11,Architecture & Planning,2-10 employees,,Sole Proprietorship,2014,"Conakry, GN","Architecture, Construction, and BTP"
FABARA Impress - Imprimerie Numerique,,00224 626 43 22 76,Printing,2-10 employees,"Conakry, Dixinn PharmaGuin√©e",Sole Proprietorship,2009,"Conakry, Dixinn PharmaGuin√©e GN","impression, offset, tshirt, tenue de travail, affiche, depliants, bache et autocallant, personnalisation des supports de communication, serigraphie, facturier, and cachet numerique"
Csk Prestige,https://csk-prestige.business.site/?utm_source=gmb&utm_medium=referral,2.25E+11,Furniture,11-50 employees,"Conakry, Ratoma,",Partnership,2020,"Conakry, Ratoma, 00224, GN",
Groupe Mondial Tours,http://www.groupemondialtours.com,,Logistics & Supply Chain,51-200 employees,"Conakry, Conakry",Privately Held,1993,"Conakry, Conakry, Conakry 2959, GN",
ANANZE BCS,http://ananze-bcs.com/,+224 627 01 43 73,Marketing & Advertising,0-1 employees,,Sole Proprietorship,2019,"Conakry, GN",
Jatropha Hub Officiel,http://www.jatrophahub.org,629519393,Professional Training & Coaching,2-10 employees,"Conakry, Guin√©e",Nonprofit,2013,"224, Conakry, Guin√©e GN",
VISTA Assurances Guin√©e,,629 95 25 25,Insurance,11-50 employees,"Conakry, Kaloum",Privately Held,,"Conakry, Kaloum GN",
HAMIDOUSIF DIGITAL,http://www.hamidousif.com,620086008,Computer Networking,2-10 employees,,Self-Employed,2020,"Kankan, GN","D√©veloppement web, Design & Graphisme, Conception de site internet, Cr√©ation de logo, D√©veloppement d'application Desktop & Mobile, and R√©f√©rencement & SEO"
CA & Ko Consulting,,,,,"Conakry, Conakry",,,"Rue du Port, Immeuble Waqf BID, Conakry, Conakry 1276, GN",
YA!GAZ Guin√©e,https://www.yagaz.com,+224 623 23 27 00,Oil & Energy,11-50 employees,,Privately Held,2014,"Matam Km 9, Conakry, BP 1562, GN",Distribution LPG Gas
